url,file_raw,file_main,processing,univariate,frequency,comment
http://www.gks.ru/free_doc/new_site/prices/potr/I_ipc.xlsx,i_ipc.xlsx,i_ipc.csv,convert_i_ipc_xlsx,TRUE,12,Monthly chained CPI from Russian Statistical Agency
http://www.gks.ru/free_doc/new_site/vvp/kv/tab5a.xls,tab5a.xls,tab5a.csv,convert_tab5a_xls,TRUE,4,Gross domestic product quarterly current prices
http://www.gks.ru/free_doc/new_site/vvp/kv/tab9a.xls,tab9a.xls,tab9a.csv,convert_tab9a_xls,TRUE,4,Deflator index in percent to the previous quarter
http://www.gks.ru/free_doc/new_site/vvp/kv/tab9.xls,tab9.xls,tab9.csv,convert_tab9_xls,TRUE,4,Deflator index in percent to the previous quarter early data
http://www.gks.ru/free_doc/new_site/vvp/kv/tab6b.xls,tab6b.xls,tab6b.csv,convert_tab6b_xls,TRUE,4,Gross domestic product quarterly 2016 prices
NA,NA,lendrate.csv,parse_lendrate,NO,12,Monthly lending rate multiple duration periods